{
  "$schema": "../../schema/rayact.module.schema.json",
  "schemaVersion": 1,
  "name": "secure-store",
  "package": "@rayact/secure-store",
  "jsEntry": ".",
  "library": "rayact_secure_store",
  "platforms": [
    "android",
    "ios",
    "darwin"
  ],
  "architectures": [
    "arm64",
    "x86_64"
  ],
  "abiRange": ">=1 <2",
  "engineRange": ">=0.0.3 <0.1.0",
  "linkage": "dynamic",
  "permissions": [
    "keychain",
    "keystore"
  ],
  "configurationSchema": {
    "type": "object",
    "additionalProperties": false
  },
  "officialDevApp": true,
  "artifacts": [
    {
      "platform": "android",
      "architecture": "arm64",
      "path": "android/arm64-v8a/librayact_secure_store.so",
      "sha256": "0df8a30b7404d56c0592cb26c993dc065cbe93745aa5b3459f6ede7a63c943d5"
    },
    {
      "platform": "android",
      "architecture": "x86_64",
      "path": "android/x86_64/librayact_secure_store.so",
      "sha256": "6d536d425f620c3de3d1445e91730394ec22019880d9d2f2fc64594ef2d974c5"
    },
    {
      "platform": "darwin",
      "architecture": "arm64",
      "path": "darwin-arm64/librayact_secure_store.dylib",
      "sha256": "2ec567616dea56f1e1deada7e1f634f292ae01f426d26460456d2431aee04e48"
    },
    {
      "platform": "darwin",
      "architecture": "x86_64",
      "path": "darwin-x64/librayact_secure_store.dylib",
      "sha256": "8fcda60939f3927e83a8d97c361843d99d36dc2bfb0d95a8984934a3a5d32afa"
    },
    {
      "platform": "ios",
      "architecture": "universal",
      "path": "ios/rayact_secure_store.xcframework",
      "sha256": "88811a8fd7943632bd23c863606049c8c1c029812abb96e28fce713694f11719"
    }
  ]
}
