{
  "$schema": "../../schema/rayact.module.schema.json",
  "schemaVersion": 1,
  "name": "crash-reporter",
  "package": "@rayact/crash-reporter",
  "jsEntry": ".",
  "library": "rayact_crash_reporter",
  "platforms": [
    "android",
    "ios",
    "darwin",
    "web"
  ],
  "architectures": [
    "arm64",
    "x86_64",
    "wasm32"
  ],
  "abiRange": ">=1 <3",
  "engineRange": ">=0.0.3 <0.1.0",
  "linkage": "dynamic",
  "permissions": [
    "crash-report-storage",
    "network-when-consented"
  ],
  "configurationSchema": {
    "type": "object",
    "additionalProperties": false,
    "properties": {
      "mode": {
        "enum": [
          "local",
          "upload"
        ]
      },
      "endpoint": {
        "type": "string",
        "format": "uri"
      },
      "maxStoredReports": {
        "type": "integer",
        "minimum": 1,
        "maximum": 100
      }
    }
  },
  "officialDevApp": true,
  "nativeSources": [
    "packages/rayact-crash-reporter/native/crash_reporter_plugin.cpp"
  ],
  "artifacts": [
    {
      "platform": "android",
      "architecture": "arm64",
      "path": "android/arm64-v8a/librayact_crash_reporter.so",
      "sha256": "1f484d19c3dd29f9e5e5833dc0647cb72cea4d2d79aa95fd865cdc5bdb57202c"
    },
    {
      "platform": "android",
      "architecture": "x86_64",
      "path": "android/x86_64/librayact_crash_reporter.so",
      "sha256": "91df9aa6d47eee27d5276338ca3865185129bbcc46a7973bff18dade56418d6e"
    },
    {
      "platform": "darwin",
      "architecture": "arm64",
      "path": "darwin-arm64/librayact_crash_reporter.dylib",
      "sha256": "64736c2a06f998fb8319bd69f9bef7e8b2136f3e762860a059c0e17fef712869"
    },
    {
      "platform": "darwin",
      "architecture": "x86_64",
      "path": "darwin-x64/librayact_crash_reporter.dylib",
      "sha256": "623fc3c2bce004fedc27585e5396fca7cdb1774613d82bdf10ae215839d624b0"
    },
    {
      "platform": "ios",
      "architecture": "universal",
      "path": "ios/rayact_crash_reporter.xcframework",
      "sha256": "1141a4ad1279365e34df7ea52e3ed0cba4a58ebb6d2a9d187a1ef833bb15ee3a"
    }
  ]
}
