{
  "$schema": "../../schema/rayact.module.schema.json",
  "schemaVersion": 1,
  "name": "mmkv",
  "package": "@rayact/mmkv",
  "jsEntry": ".",
  "library": "rayact_mmkv",
  "platforms": [
    "android",
    "ios",
    "darwin"
  ],
  "architectures": [
    "arm64",
    "x86_64"
  ],
  "abiRange": ">=1 <2",
  "engineRange": ">=0.0.3 <0.1.0",
  "linkage": "dynamic",
  "permissions": [],
  "configurationSchema": {
    "type": "object",
    "additionalProperties": false
  },
  "officialDevApp": true,
  "artifacts": [
    {
      "platform": "android",
      "architecture": "arm64",
      "path": "android/arm64-v8a/librayact_mmkv.so",
      "sha256": "9e882061106042be5ad6262cfbae5e5778f6f5eea042775b67b7849cd5c31062"
    },
    {
      "platform": "android",
      "architecture": "x86_64",
      "path": "android/x86_64/librayact_mmkv.so",
      "sha256": "6b0ef31c4d6caf290d3e1d569af1a507f6731a0f7393bb6836bd33705f4e7fa8"
    },
    {
      "platform": "darwin",
      "architecture": "arm64",
      "path": "darwin-arm64/librayact_mmkv.dylib",
      "sha256": "d96f3d6bcec2e0fbfd1a95353ab09575c4347f24e8f9f6f5a657218f1fe2a198"
    },
    {
      "platform": "darwin",
      "architecture": "x86_64",
      "path": "darwin-x64/librayact_mmkv.dylib",
      "sha256": "4ef45a208c6bc0ad81f9736ed9a0da1663b144dce7aa185d8235e92def09918d"
    },
    {
      "platform": "ios",
      "architecture": "universal",
      "path": "ios/rayact_mmkv.xcframework",
      "sha256": "ea0277664604e13725c54c79587dd99b4438087a1036a348cae059e7e8f4f0db"
    }
  ]
}
